{
  "$schema": "https://json-schema.org/draft/2020-12/schema",
  "title": "DecisionLogEntry",
  "type": "array",
  "items": {
    "type": "object",
    "required": ["id", "campaignId", "severity", "decisionText", "owner", "dueDate", "createdAt"],
    "properties": {
      "id": { "type": "string", "minLength": 1 },
      "campaignId": { "type": "string", "minLength": 1 },
      "severity": { "enum": ["amber", "red", "critical"] },
      "decisionText": { "type": "string", "minLength": 1 },
      "owner": { "type": "string", "minLength": 1 },
      "dueDate": { "type": "string", "format": "date" },
      "createdAt": { "type": "string", "format": "date" }
    }
  }
}
